[
  {
    "id": "rel:v1_6_0_batch_04:akm:uses_ammunition:7_62x39",
    "source_id": "ckb:weapon:firearm:akm",
    "predicate": "uses_ammunition",
    "target_id": "ckb:ammunition:cartridge:7_62x39",
    "confidence": 0.95,
    "qualifiers": {"scope": "standard_chambering"},
    "provenance": {
      "review_status": "unverified",
      "sources": [
        {"source_id": "wikipedia", "url": "https://en.wikipedia.org/wiki/AKM"}
      ]
    }
  }
]
