[
  {"id":"rel:v1_7_complete:chrysler:produces:m1_abrams","source_id":"ckb:organization:manufacturer:chrysler_defense","predicate":"produces","target_id":"ckb:platform:ground:m1_abrams","confidence":0.85,"qualifiers":{"scope":"M1 Abrams production lineage"},"provenance":{"review_status":"source_checked","sources":[{"source_id":"us_army","url":"https://history.army.mil/books/Lineage/M1Abrams.pdf"}]}},
  {"id":"rel:v1_7_complete:gavin:designed:m1_abrams","source_id":"ckb:person:designer:joseph_gavin","predicate":"designed","target_id":"ckb:platform:ground:m1_abrams","confidence":0.75,"qualifiers":{"scope":"design leadership attribution"},"provenance":{"review_status":"source_checked","sources":[{"source_id":"us_army","url":"https://history.army.mil/books/Lineage/M1Abrams.pdf"}]}},
  {"id":"rel:v1_7_complete:arsenal:located_in:detroit","source_id":"ckb:facility:arsenal:detroit_arsenal","predicate":"located_in","target_id":"ckb:place:facility:detroit","confidence":0.95,"qualifiers":{"scope":"Detroit Arsenal location"},"provenance":{"review_status":"source_checked","sources":[{"source_id":"usgs","url":"https://www.usgs.gov/centers/eros/science/geographic-names-information-system-gnis"}]}},
  {"id":"rel:v1_7_complete:unit:participated_in:d_day","source_id":"ckb:unit:military:us_1st_infantry_division","predicate":"participated_in","target_id":"ckb:battle:normandy:d_day","confidence":0.99,"qualifiers":{"scope":"1st Infantry Division official history"},"provenance":{"review_status":"source_checked","sources":[{"source_id":"us_army_1id","url":"https://www.1id.army.mil/About-Us/Mission-History/"}]}},
  {"id":"rel:v1_7_complete:d_day:part_of:wwii","source_id":"ckb:battle:normandy:d_day","predicate":"part_of","target_id":"ckb:conflict:world_war_ii","confidence":0.99,"qualifiers":{"scope":"D-Day as a WWII operation"},"provenance":{"review_status":"source_checked","sources":[{"source_id":"imperial_war_museums","url":"https://www.iwm.org.uk/history/the-10-things-you-need-to-know-about-d-day"}]}}
]
