[
  {"id":"rel:v1_6_3_batch_02:daring:member_of_class:type_45","source_id":"ckb:platform:naval:hms_daring_d32","predicate":"member_of_class","target_id":"ckb:platform:naval:type_45_daring_class","confidence":0.99,"qualifiers":{"scope":"named vessel and class membership"},"provenance":{"review_status":"source_checked","sources":[{"source_id":"royal_navy_hms_daring","url":"https://www.royalnavy.mod.uk/organisation/units-and-squadrons/destroyers/hms-daring"},{"source_id":"royal_navy_daring_class","url":"https://www.royalnavy.mod.uk/equipment/ships/daring-class"}]}},
  {"id":"rel:v1_6_3_batch_02:daring:operated_by:royal_navy","source_id":"ckb:platform:naval:hms_daring_d32","predicate":"operated_by","target_id":"ckb:organization:military:royal_navy","confidence":0.99,"qualifiers":{"scope":"commissioned service relationship"},"provenance":{"review_status":"source_checked","sources":[{"source_id":"royal_navy_hms_daring","url":"https://www.royalnavy.mod.uk/organisation/units-and-squadrons/destroyers/hms-daring"},{"source_id":"uk_government_royal_navy","url":"https://www.gov.uk/government/organisations/royal-navy"}]}},
  {"id":"rel:v1_6_3_batch_02:type_45:uses_engine:wr_21","source_id":"ckb:platform:naval:type_45_daring_class","predicate":"uses_engine","target_id":"ckb:component:engine:rolls_royce_wr_21","confidence":0.98,"qualifiers":{"scope":"Type 45 propulsion configuration","configuration_specific":true},"provenance":{"review_status":"source_checked","sources":[{"source_id":"rolls_royce_wr21_support","url":"https://www.rolls-royce.com/media/press-releases-archive/yr-2011/110525-innovative-support-contract.aspx"},{"source_id":"rolls_royce_wr21_selection","url":"https://www.rolls-royce.com/~/media/Files/R/Rolls-Royce/documents/investors/results/presentations-and-briefings/jun-11-paris-airshow-briefing.pdf"}]}},
  {"id":"rel:v1_6_3_batch_02:type_45:uses_sensor:sampson","source_id":"ckb:platform:naval:type_45_daring_class","predicate":"uses_sensor","target_id":"ckb:component:sensor:sampson_radar","confidence":0.99,"qualifiers":{"scope":"Type 45 sensor fit","configuration_specific":true},"provenance":{"review_status":"source_checked","sources":[{"source_id":"royal_navy_daring_class","url":"https://www.royalnavy.mod.uk/equipment/ships/daring-class"},{"source_id":"royal_navy_daring_sea_viper","url":"https://www.royalnavy.mod.uk/news/2016/july/11/160711-daring-sea-viper"}]}},
  {"id":"rel:v1_6_3_batch_02:type_45:armed_with:sea_viper","source_id":"ckb:platform:naval:type_45_daring_class","predicate":"armed_with","target_id":"ckb:weapon:naval:sea_viper","confidence":0.99,"qualifiers":{"scope":"Type 45 principal air-defense system","configuration_specific":true},"provenance":{"review_status":"source_checked","sources":[{"source_id":"royal_navy_daring_class","url":"https://www.royalnavy.mod.uk/equipment/ships/daring-class"},{"source_id":"royal_navy_sea_viper","url":"https://www.royalnavy.mod.uk/news/2022/may/24/20220524-sea-viper"}]}},
  {"id":"rel:v1_6_3_batch_02:uss_virginia:member_of_class:virginia","source_id":"ckb:platform:naval:uss_virginia_ssn_774","predicate":"member_of_class","target_id":"ckb:platform:naval:virginia_class","confidence":0.99,"qualifiers":{"scope":"lead vessel and class membership"},"provenance":{"review_status":"source_checked","sources":[{"source_id":"sublant_uss_virginia","url":"https://www.sublant.usff.navy.mil/SSN774/"},{"source_id":"us_navy_attack_submarines","url":"https://www.navy.mil/Resources/Fact-Files/fact-files/display/display-factfiles/article/Article/2169558/attack-submarines-ssn/"}]}},
  {"id":"rel:v1_6_3_batch_02:uss_virginia:operated_by:us_navy","source_id":"ckb:platform:naval:uss_virginia_ssn_774","predicate":"operated_by","target_id":"ckb:organization:military:united_states_navy","confidence":0.99,"qualifiers":{"scope":"commissioned service relationship"},"provenance":{"review_status":"source_checked","sources":[{"source_id":"sublant_uss_virginia","url":"https://www.sublant.usff.navy.mil/SSN774/"},{"source_id":"us_navy_about","url":"https://www.navy.mil/About/"}]}},
  {"id":"rel:v1_6_3_batch_02:virginia:uses_engine:nuclear_propulsion","source_id":"ckb:platform:naval:virginia_class","predicate":"uses_engine","target_id":"ckb:component:engine:virginia_class_nuclear_propulsion","confidence":0.99,"qualifiers":{"scope":"public class-level propulsion summary","configuration_specific":true},"provenance":{"review_status":"source_checked","sources":[{"source_id":"navsea_nuclear_propulsion","url":"https://www.navsea.navy.mil/Portals/103/Documents/PSNSY_IMF/News%20Releases/2013%20Naval%20Nuclear%20Propulsion%20Program.pdf?ver=2017-03-02-113143-683"},{"source_id":"us_navy_attack_submarines","url":"https://www.navy.mil/Resources/Fact-Files/fact-files/display/display-factfiles/article/Article/2169558/attack-submarines-ssn/"}]}},
  {"id":"rel:v1_6_3_batch_02:virginia:uses_sensor:bps_16","source_id":"ckb:platform:naval:virginia_class","predicate":"uses_sensor","target_id":"ckb:component:sensor:an_bps_16_v4","confidence":0.97,"qualifiers":{"scope":"first ten Virginia-class hulls","configuration_specific":true},"provenance":{"review_status":"source_checked","sources":[{"source_id":"us_navy_bps_radar","url":"https://www.navy.mil/Resources/Fact-Files/Display-FactFiles/Article/2166767/anbps-1516-radar/"},{"source_id":"us_navy_attack_submarines","url":"https://www.navy.mil/Resources/Fact-Files/fact-files/display/display-factfiles/article/Article/2169558/attack-submarines-ssn/"}]}},
  {"id":"rel:v1_6_3_batch_02:virginia:armed_with:tomahawk","source_id":"ckb:platform:naval:virginia_class","predicate":"armed_with","target_id":"ckb:weapon:missile:tomahawk_tlam","confidence":0.99,"qualifiers":{"scope":"documented Virginia-class armament","configuration_specific":true},"provenance":{"review_status":"source_checked","sources":[{"source_id":"us_navy_tomahawk","url":"https://www.navy.mil/DesktopModules/ArticleCS/Print.aspx?Article=2169229&ModuleId=724&PortalId=1"},{"source_id":"us_navy_attack_submarines","url":"https://www.navy.mil/Resources/Fact-Files/fact-files/display/display-factfiles/article/Article/2169558/attack-submarines-ssn/"}]}},
  {"id":"rel:v1_6_3_batch_02:arleigh_burke:uses_sensor:spy_1d","source_id":"ckb:platform:naval:arleigh_burke_class","predicate":"uses_sensor","target_id":"ckb:component:sensor:an_spy_1d","confidence":0.98,"qualifiers":{"scope":"Aegis-equipped Arleigh Burke class","configuration_specific":true},"provenance":{"review_status":"source_checked","sources":[{"source_id":"us_navy_aegis","url":"https://www.navy.mil/Resources/Fact-Files/Display-FactFiles/Article/2166739/aegis-weapon-system/"},{"source_id":"us_navy_destroyers","url":"https://www.navy.mil/Resources/Fact-Files/Display-FactFiles/Article/2169871/destroyers-ddg/destroyers-ddg-51/"}]}},
  {"id":"rel:v1_6_3_batch_02:arleigh_burke:armed_with:mk_41","source_id":"ckb:platform:naval:arleigh_burke_class","predicate":"armed_with","target_id":"ckb:weapon:naval:mk_41_vls","confidence":0.99,"qualifiers":{"scope":"Aegis-equipped Arleigh Burke class","configuration_specific":true},"provenance":{"review_status":"source_checked","sources":[{"source_id":"us_navy_aegis","url":"https://www.navy.mil/Resources/Fact-Files/Display-FactFiles/Article/2166739/aegis-weapon-system/"},{"source_id":"us_navy_destroyers","url":"https://www.navy.mil/Resources/Fact-Files/Display-FactFiles/Article/2169871/destroyers-ddg/destroyers-ddg-51/"}]}}
]
