[
  {"id":"rel:v1_6_4_batch_02:javelin:uses_sensor:clu","source_id":"ckb:weapon:missile:fgm_148_javelin","predicate":"uses_sensor","target_id":"ckb:component:sensor:javelin_command_launch_unit","confidence":0.99,"qualifiers":{"scope":"Javelin reusable CLU and round system boundary","configuration_specific":true},"provenance":{"review_status":"source_checked","sources":[{"source_id":"us_army_javelin_tc","url":"https://rdl.train.army.mil/catalog-ws/view/100.ATSC/58016C43-60DA-41F3-8B76-72536FC5B799-1376939376712/tc_3-22x37.pdf"},{"source_id":"redstone_javelin_history","url":"https://history.redstone.army.mil/miss-javelin.html"}]}},
  {"id":"rel:v1_6_4_batch_02:iron_dome:uses_sensor:elm_2084","source_id":"ckb:system:air_defense:iron_dome","predicate":"uses_sensor","target_id":"ckb:component:sensor:elm_2084_mmr","confidence":0.99,"qualifiers":{"scope":"Iron Dome MMR sensor component","configuration_specific":true},"provenance":{"review_status":"source_checked","sources":[{"source_id":"israel_mod_ddrd","url":"https://mod.gov.il/en/departments/directorate-of-defense-research-development-ddrd"},{"source_id":"iai_elm2084","url":"https://www.iai.co.il/wp-content/uploads/2026/04/2084-MS-MMR.pdf"}]}},
  {"id":"rel:v1_6_4_batch_02:iron_dome:armed_with:tamir","source_id":"ckb:system:air_defense:iron_dome","predicate":"armed_with","target_id":"ckb:weapon:missile:tamir_interceptor","confidence":0.99,"qualifiers":{"scope":"Iron Dome interceptor component","configuration_specific":true},"provenance":{"review_status":"source_checked","sources":[{"source_id":"rtx_iron_dome","url":"https://www.rtx.com/raytheon/what-we-do/integrated-air-and-missile-defense/irondome"},{"source_id":"israel_mod_tamir_mric","url":"https://mod.gov.il/en/press-releases/press-room/the-us-marines-have-successfully-completed-their-first-live-fire-training-with-an-air-defense-system-integrating-the-iron-dome-interceptor"}]}},
  {"id":"rel:v1_6_4_batch_02:nasams:uses_sensor:sentinel","source_id":"ckb:system:air_defense:nasams","predicate":"uses_sensor","target_id":"ckb:component:sensor:an_mpq_64_sentinel","confidence":0.99,"qualifiers":{"scope":"standard NASAMS unit public configuration","configuration_specific":true},"provenance":{"review_status":"source_checked","sources":[{"source_id":"kongsberg_nasams","url":"https://www.kongsberg.com/what-we-do/defence-and-security/integrated-air-and-missile-defence/nasams-air-defence-system/"},{"source_id":"kongsberg_nasams_brochure","url":"https://www.kongsberg.com/globalassets/kongsberg/1.-what-we-do/1.-defence-and-security/intergrated-air-and-missile-defence/nasams-air-defence-system/nasams_brochure_2026.pdf"}]}},
  {"id":"rel:v1_6_4_batch_02:nasams:armed_with:aim_120","source_id":"ckb:system:air_defense:nasams","predicate":"armed_with","target_id":"ckb:weapon:missile:aim_120_amraam","confidence":0.99,"qualifiers":{"scope":"standard NASAMS AMRAAM effector configuration","configuration_specific":true},"provenance":{"review_status":"source_checked","sources":[{"source_id":"kongsberg_nasams","url":"https://www.kongsberg.com/what-we-do/defence-and-security/integrated-air-and-missile-defence/nasams-air-defence-system/"},{"source_id":"us_air_force_amraam","url":"https://www.af.mil/News/Article-Display/Article/104576/aim-120-amraam/"}]}}
]
