[{"id":"rel:v1_6_0_batch_01:m26_pershing:m46_patton","source_id":"ckb:platform:ground:m26_pershing","predicate":"developed_into","target_id":"ckb:platform:ground:m46_patton","confidence":0.9,"qualifiers":{"scope":"armored_vehicle_development"},"provenance":{"review_status":"source_checked","sources":[{"source_id":"wikipedia","url":"https://en.wikipedia.org/wiki/M26_Pershing"},{"source_id":"tank_museum","url":"https://tankmuseum.org/article/the-patton-family"}]}},{"id":"rel:v1_6_0_batch_01:m46_patton:m47_patton","source_id":"ckb:platform:ground:m46_patton","predicate":"developed_into","target_id":"ckb:platform:ground:m47_patton","confidence":0.9,"qualifiers":{"scope":"armored_vehicle_development"},"provenance":{"review_status":"source_checked","sources":[{"source_id":"wikipedia","url":"https://en.wikipedia.org/wiki/M46_Patton"},{"source_id":"tank_museum","url":"https://tankmuseum.org/tank-nuts/tank-collection/m47/"}]}},{"id":"rel:v1_6_0_batch_01:m47_patton:m48_patton","source_id":"ckb:platform:ground:m47_patton","predicate":"development_line_predecessor","target_id":"ckb:platform:ground:m48_patton","confidence":0.9,"qualifiers":{"scope":"armored_vehicle_development"},"provenance":{"review_status":"source_checked","sources":[{"source_id":"wikipedia","url":"https://en.wikipedia.org/wiki/M47_Patton"},{"source_id":"tank_museum","url":"https://tankmuseum.org/article/history-of-the-m47"}]}},{"id":"rel:v1_6_0_batch_01:m48_patton:m60_tank","source_id":"ckb:platform:ground:m48_patton","predicate":"developed_into","target_id":"ckb:platform:ground:m60_tank","confidence":0.9,"qualifiers":{"scope":"armored_vehicle_development"},"provenance":{"review_status":"source_checked","sources":[{"source_id":"wikipedia","url":"https://en.wikipedia.org/wiki/M48_Patton"},{"source_id":"official_military","url":"https://history.army.mil/Archives/Army-Heritage-Trail/CW/"}]}},{"id":"rel:v1_6_0_batch_01:m60_tank:m1_abrams","source_id":"ckb:platform:ground:m60_tank","predicate":"development_line_predecessor","target_id":"ckb:platform:ground:m1_abrams","confidence":0.9,"qualifiers":{"scope":"armored_vehicle_development"},"provenance":{"review_status":"source_checked","sources":[{"source_id":"wikipedia","url":"https://en.wikipedia.org/wiki/M60_tank"},{"source_id":"official_military","url":"https://www.army.mil/article/86839/AMC_developed_weapons_remain_vital_to_Army/"}]}},{"id":"rel:v1_6_0_batch_01:cromwell_tank:comet_tank","source_id":"ckb:platform:ground:cromwell_tank","predicate":"developed_into","target_id":"ckb:platform:ground:comet_tank","confidence":0.95,"qualifiers":{"scope":"armored_vehicle_development"},"provenance":{"review_status":"source_checked","sources":[{"source_id":"wikipedia","url":"https://en.wikipedia.org/wiki/Cromwell_tank"},{"source_id":"tank_museum","url":"https://tankmuseum.org/tank-nuts/tank-collection/comet/"}]}},{"id":"rel:v1_6_0_batch_01:comet_tank:centurion_tank","source_id":"ckb:platform:ground:comet_tank","predicate":"contemporary","target_id":"ckb:platform:ground:centurion_tank","confidence":0.9,"qualifiers":{"scope":"late_world_war_two_british_tanks"},"provenance":{"review_status":"source_checked","sources":[{"source_id":"tank_museum","url":"https://tankmuseum.org/tank-nuts/tank-collection/comet/"},{"source_id":"tank_museum","url":"https://tankmuseum.org/tank-nuts/tank-collection/centurion/"}]}},{"id":"rel:v1_6_0_batch_01:centurion_tank:chieftain_tank","source_id":"ckb:platform:ground:centurion_tank","predicate":"development_line_predecessor","target_id":"ckb:platform:ground:chieftain_tank","confidence":0.85,"qualifiers":{"scope":"british_main_battle_tank_line"},"provenance":{"review_status":"source_checked","sources":[{"source_id":"tank_museum","url":"https://tankmuseum.org/tank-nuts/tank-collection/centurion/"},{"source_id":"tank_museum","url":"https://tankmuseum.org/tank-nuts/tank-collection/chieftain/"}]}},{"id":"rel:v1_6_0_batch_01:chieftain_tank:challenger_1","source_id":"ckb:platform:ground:chieftain_tank","predicate":"development_line_predecessor","target_id":"ckb:platform:ground:challenger_1","confidence":0.7,"qualifiers":{"scope":"british_main_battle_tank_line","direct_development":false},"provenance":{"review_status":"source_checked","sources":[{"source_id":"tank_museum","url":"https://tankmuseum.org/tank-nuts/tank-collection/chieftain/"},{"source_id":"tank_museum","url":"https://tankmuseum.org/article/tankfest-stars-2026"}]}},{"id":"rel:v1_6_0_batch_01:challenger_1:challenger_2","source_id":"ckb:platform:ground:challenger_1","predicate":"development_line_predecessor","target_id":"ckb:platform:ground:challenger_2","confidence":0.95,"qualifiers":{"scope":"british_main_battle_tank_line","replacement_relationship":true},"provenance":{"review_status":"source_checked","sources":[{"source_id":"wikipedia","url":"https://en.wikipedia.org/wiki/Challenger_1"},{"source_id":"official_military","url":"https://www.army.mod.uk/learn-and-explore/equipment/combat-vehicles/challenger-2/"}]}},{"id":"rel:v1_6_0_batch_01:amx_30:leclerc_tank","source_id":"ckb:platform:ground:amx_30","predicate":"development_line_predecessor","target_id":"ckb:platform:ground:leclerc_tank","confidence":0.95,"qualifiers":{"scope":"french_main_battle_tank_line","replacement_relationship":true},"provenance":{"review_status":"source_checked","sources":[{"source_id":"wikipedia","url":"https://en.wikipedia.org/wiki/AMX-30"},{"source_id":"tank_museum","url":"https://museedesblindes.fr/les_chars/lamx-leclerc/"}]}},{"id":"rel:v1_6_0_batch_01:type_59_tank:type_69_tank","source_id":"ckb:platform:ground:type_59_tank","predicate":"developed_into","target_id":"ckb:platform:ground:type_69_tank","confidence":0.85,"qualifiers":{"scope":"chinese_tank_development"},"provenance":{"review_status":"source_checked","sources":[{"source_id":"wikipedia","url":"https://en.wikipedia.org/wiki/Type_59_tank"},{"source_id":"professional_reference","url":"https://weaponsystems.net/system/1572-Type%2059"}]}},{"id":"rel:v1_6_0_batch_01:type_69_tank:type_80_tank","source_id":"ckb:platform:ground:type_69_tank","predicate":"development_line_predecessor","target_id":"ckb:platform:ground:type_80_tank","confidence":0.8,"qualifiers":{"scope":"chinese_tank_development","direct_development":false},"provenance":{"review_status":"source_checked","sources":[{"source_id":"wikipedia","url":"https://en.wikipedia.org/wiki/Type_69_tank"},{"source_id":"professional_reference","url":"https://www.armytanks.org/1980s-tanks/type-80-main-battle-tank.html"}]}},{"id":"rel:v1_6_0_batch_01:type_80_tank:type_96_tank","source_id":"ckb:platform:ground:type_80_tank","predicate":"influenced","target_id":"ckb:platform:ground:type_96_tank","confidence":0.6,"qualifiers":{"scope":"chinese_tank_development","broad_design_influence":true,"direct_development":false},"provenance":{"review_status":"unverified","sources":[{"source_id":"wikipedia","url":"https://en.wikipedia.org/wiki/Type_80_tank"}]}},{"id":"rel:v1_6_0_batch_01:type_80_tank:type_99_tank","source_id":"ckb:platform:ground:type_80_tank","predicate":"influenced","target_id":"ckb:platform:ground:type_99_tank","confidence":0.55,"qualifiers":{"scope":"chinese_tank_development","broad_design_influence":true,"direct_development":false},"provenance":{"review_status":"unverified","sources":[{"source_id":"wikipedia","url":"https://en.wikipedia.org/wiki/Type_80_tank"}]}},{"id":"rel:v1_6_0_batch_01:type_61_tank:type_74_tank","source_id":"ckb:platform:ground:type_61_tank","predicate":"development_line_predecessor","target_id":"ckb:platform:ground:type_74_tank","confidence":0.95,"qualifiers":{"scope":"japanese_main_battle_tank_line","replacement_relationship":true},"provenance":{"review_status":"source_checked","sources":[{"source_id":"wikipedia","url":"https://en.wikipedia.org/wiki/Type_61_(tank)"},{"source_id":"official_military","url":"https://www.mod.go.jp/gsdf/nae/7d/siryoukan.html"}]}},{"id":"rel:v1_6_0_batch_01:type_74_tank:type_90_tank","source_id":"ckb:platform:ground:type_74_tank","predicate":"development_line_predecessor","target_id":"ckb:platform:ground:type_90_tank","confidence":0.9,"qualifiers":{"scope":"japanese_main_battle_tank_line","replacement_relationship":true},"provenance":{"review_status":"source_checked","sources":[{"source_id":"wikipedia","url":"https://en.wikipedia.org/wiki/Type_74"},{"source_id":"official_military","url":"https://www.mod.go.jp/gsdf/nae/7d/siryoukan.html"}]}},{"id":"rel:v1_6_0_batch_01:type_90_tank:type_10_tank","source_id":"ckb:platform:ground:type_90_tank","predicate":"development_line_predecessor","target_id":"ckb:platform:ground:type_10_tank","confidence":0.85,"qualifiers":{"scope":"japanese_main_battle_tank_line","replacement_generation":true,"direct_upgrade":false},"provenance":{"review_status":"source_checked","sources":[{"source_id":"wikipedia","url":"https://en.wikipedia.org/wiki/Type_90_tank"},{"source_id":"official_military","url":"https://www.mod.go.jp/atla/saiyou/gallery/sobihin.html"}]}}]